Job Title,Job Description,Skills,Certifications
Network and Systems Administrator,"Manages network infrastructure and systems to ensure operational efficiency. Responsibilities include troubleshooting, maintenance, and user support.","Automation, Backup, CCNA, Firewalls, Linux, Networking, Routers, Scripting, Shell Scripting, Switches, System Administration, Troubleshooting, Virtualization, Windows Server","CompTIA Network+, Cisco CCNA"
Network Engineer,"Designs, implements, and manages network solutions to ensure reliable connectivity. Responsibilities include configuring routers/switches and monitoring network performance.","CCNA, Cisco, Firewalls, LAN/WAN, Linux, Networking, Networking Protocols, Routers, Routing, Security, Switches, Switching, TCP/IP, VPN","Cisco CCNA, CompTIA Network+"
New Grad Software Engineer,Entry-level position focused on software development tasks while gaining practical experience in coding/debugging under supervision.,"Algorithms, CSS, Data Structures, Git, HTML, Java, JavaScript, Python, SQL","CompTIA IT Fundamentals+, Coding Bootcamp Certificates"
New Relic Engineer,"Utilizes New Relic for application performance monitoring. Responsibilities include configuring dashboards, analyzing metrics, and optimizing application performance.",".NET, Alerting, Application Performance Monitoring, Cloud Computing, Java, Metrics, New Relic, Troubleshooting","New Relic Monitoring and Observability Certifications, AWS Certified DevOps Engineer â Professional"
Nexus Engineer,Manages Nexus repository for artifact management in CI/CD pipelines. Responsible for configuring repositories and ensuring efficient artifact storage.,"Artifact Repository, Build Automation, CI/CD, Docker, Gradle, Maven, Nexus","Nexus Repository Manager Certification, DevOps Institute Certifications"
Nomad Engineer,Implements Nomad for workload orchestration across distributed systems. Responsibilities include managing job definitions and ensuring service availability.,"Automation, Cloud Computing, Container Orchestration, Docker, Linux, Networking, Nomad","HashiCorp Certified: Nomad Associate, Cloud Native Computing Foundation Certifications"
Notary Engineer,Utilizes Notary for secure signing of container images. Responsible for implementing trust management within containerized environments.,"Container Security, Cryptography, Docker, Notary, Security, Trust Management","Notary Security Certifications, Docker Security Certifications"
Octopus Deploy Engineer,Manages deployment processes using Octopus Deploy. Responsibilities include configuring deployment projects and automating release workflows.,".NET, CI/CD, Cloud Computing, Deployment Automation, Octopus Deploy, PowerShell, Scripting","Octopus Deploy Certification, CI/CD Certifications"
OpenShift Engineer,"Administers OpenShift container platform for deploying applications. Responsibilities include managing clusters, scaling applications, and ensuring uptime.","Automation, CI/CD, Cloud Computing, Docker, Kubernetes, Linux, OpenShift, Security","Red Hat OpenShift Administration Certification, Kubernetes Administrator Certification"
OpenStack Engineer,Implements OpenStack solutions for cloud infrastructure management. Responsible for deploying services and managing virtualized resources.,"Automation, Cloud Computing, Linux, Networking, OpenStack, Scripting, Virtualization","OpenStack Administrator Certification, Cloud Infrastructure Certifications"
Oracle Developer,"Develops applications using Oracle technologies including PL/SQL. Responsibilities include database design, coding, testing, and optimization.","C++, Database Design, ETL, Git, Java, OOP, Oracle, PL/SQL, Performance Tuning, Python, REST APIs, SQL","Oracle Certified Professional, Java SE Programmer, Oracle Database SQL Certified Associate"
Oracle SQL Developer,"Utilizes Oracle SQL Developer to manage database development tasks including writing queries, creating reports, and optimizing database performance.","C++, Database Development, ETL, Git, Java, OOP, Oracle SQL Developer, PL/SQL, Performance Tuning, Python, REST APIs, SQL","Oracle SQL Certified Associate, Oracle Database SQL Expert"
Packer Engineer,Uses Packer to automate the creation of machine images across platforms. Responsible for maintaining image templates and ensuring consistency in deployments.,"AWS, Automation, Azure, Cloud Computing, Google Cloud, Infrastructure as Code, Packer","HashiCorp Certified: Packer Associate, Infrastructure as Code Certifications"
PHP Developer,"Develops web applications using PHP programming language. Responsibilities include coding, debugging, and collaborating with front-end developers on integrations.","C++, CSS, Git, HTML, Java, JavaScript, Laravel, MySQL, OOP, PHP, Python, REST APIs, RESTful APIs, Symfony","Zend Certified PHP Engineer, PHP Framework Certifications"
Powershell Engineer,Utilizes PowerShell scripting to automate administrative tasks in Windows environments. Responsible for writing scripts to manage system configurations.,"Active Directory, Automation, Cloud Computing, PowerShell, Scripting, Windows Server","Microsoft Certified: Azure Administrator Associate, Windows PowerShell Training"
PRODUCT MANAGER,"Oversees product development from conception to launch. Responsibilities include defining product vision, gathering requirements, and coordinating cross-functional teams.","Agile, Agile Methodologies, Budgeting, Communication, Leadership, Market Research, Product Management, Project Planning, Roadmap Planning, Roadmaps, Scrum, Stakeholder Management, User Research","Certified Scrum Product Owner (CSPO), Product Management Professional (PMP)"
Programmer,Writes code to develop software applications based on specifications provided by stakeholders. Collaborates with other developers on coding best practices.,"Algorithms, C++, Data Structures, Debugging, Java, Programming, Python, Software Development","CompTIA IT Fundamentals+, Microsoft Certified: Azure Fundamentals, Oracle Certified Associate (OCA) in Java/Python, AWS Certified Developer - Associate"
Programmer Analyst,"Analyzes business requirements to develop software solutions. Responsibilities include coding, testing, debugging, and providing technical support.","Data Analysis, Data Modeling, Process Improvement, Programming, Requirements Gathering, SQL"," CompTIA IT Fundamentals+, Microsoft Certified: Azure Fundamentals, Oracle Certified Associate (OCA) in Java/Python, AWS Certified Developer - Associate"
Prometheus Engineer,Implements Prometheus monitoring solutions to track application performance metrics. Responsible for configuring alerts/dashboards based on metrics collected.,"Alerting, Cloud Computing, Docker, Kubernetes, Metrics, Monitoring, Prometheus","Certified Kubernetes Administrator (CKA), Grafana Cloud Monitoring Certification, Prometheus Certified Associate (PCA) "
Puppet Engineer,Utilizes Puppet for configuration management tasks across environments. Responsibilities include writing manifests/scripts to automate system configurations.,"AWS, Automation, Azure, Cloud Computing, Configuration Management, Infrastructure as Code, Linux, Puppet, Ruby","Puppet Certified Professional, Red Hat Certified Specialist in Configuration Management, AWS Certified DevOps Engineer"
PyTest Engineer,Uses PyTest framework to write unit tests for Python applications. Responsible for ensuring code quality through automated testing practices.,"CI/CD, PyTest, Python, Test Automation, Testing, Unit Testing","ISTQB Certified Tester, Certified Python Developer (PCAP, PCPP), Selenium WebDriver with Python Certification"
Python Developer,"Develops software applications using Python programming language. Responsibilities include writing code, debugging issues, and collaborating with other developers.","Algorithms, C++, Cloud Computing, Data Structures, Django, Docker, Flask, Git, Java, Linux, NumPy, OOP, Pandas, Python, REST APIs, SQL","Microsoft Certified: Python Programming, Google Professional Data Engineer, AWS Certified Developer - Associate, PCAP (Certified Associate in Python Programming)"
QA Engineer,Implements testing strategies to ensure software quality through manual/automated testing methods while collaborating with development teams on quality standards.,"Agile Testing, Automation Testing, CI/CD, Git, JUnit, Jenkins, Performance Testing, Python, Selenium, Test Automation, TestNG","ISTQB Foundation Level, Certified Software Quality Analyst (CSQA), Certified Software Test Engineer (CSTE)"
React Developer,Develops user interfaces using React.js framework. Responsibilities include implementing responsive designs and optimizing application performance.,"C++, CSS, Git, HTML, Java, JavaScript, Node.js, OOP, Python, REST APIs, React, Redux, UI/UX Design","Meta Front-End Developer Certificate, React Nanodegree (Udacity), AWS Certified Developer - Associate"
Robotics Engineer,Designs robotic systems by developing software/hardware components that enable robots to perform tasks autonomously or semi-autonomously.,"Actuators, C++, Control Systems, Embedded Systems, Python, ROS, Robotics, Sensors","Certified LabVIEW Developer (CLD), ROS (Robot Operating System) Certification, Siemens Mechatronic Systems Certification"
RUBY ON RAILS DEVELOPER,Develops web applications using Ruby on Rails framework while focusing on back-end logic/integrating front-end components.,"C++, CSS, Deep Learning, Git, HTML, Java, JavaScript, Neural Networks, OOP, PyTorch, Python, REST APIs, Ruby, Ruby on Rails, SQL, TensorFlow","Ruby Association Certified Ruby Programmer, AWS Certified Developer - Associate"
Salesforce Developer,Customizes Salesforce platform by developing applications/components using Apex/Visualforce while ensuring alignment with business processes.,"Apex, C++, Git, Java, Lightning, OOP, Python, REST APIs, SOQL, Salesforce, Salesforce Administration, Visualforce","Salesforce Certified Platform Developer I & II, Salesforce Certified Administrator"
Search Engine Optimization,No description available,"Analytics, Content Marketing, Keyword Research, Off-Page Optimization, On-Page Optimization, SEO","Google Analytics Certification, HubSpot Content Marketing Certification, SEMrush SEO Fundamentals Certification"
SECURITY SPECIALIST,Protects organizational data by implementing security measures. Responsibilities include conducting risk assessments and responding to security incidents.,"Ethical Hacking, Firewalls, IDS/IPS, Linux, Network Security, Penetration Testing, Security, Security Auditing, Vulnerability Management","Certified Ethical Hacker (CEH), CISSP (Certified Information Systems Security Professional), CompTIA Security+, OSCP (Offensive Security Certified Professional)"
Selenium Engineer,"Designs and develops automated test scripts using Selenium. Responsibilities include creating test plans, executing tests, and reporting defects.","CI/CD, Java, Python, Selenium, Test Automation, Testing Frameworks, WebDriver","ISTQB Advanced Test Automation Engineer, Certified Selenium Professional, Test Automation Engineer (TAE) Certification"
Senior Ansible Development Engineer,Leads development efforts for Ansible-based automation solutions. Responsibilities include mentoring junior engineers and designing complex playbooks.,"AWS, Ansible, Automation, Azure, Cloud Computing, Infrastructure as Code, Leadership, Linux, Networking, Python, Scripting","Red Hat Certified Specialist in Ansible Automation, AWS Certified DevOps Engineer - Professional"
Senior Cloud Architect,Designs and implements cloud solutions at a senior level. Responsibilities include cloud strategy development and providing guidance on cloud best practices.,"AWS, Azure, Cloud Architecture, Docker, GCP, Google Cloud, Kubernetes, Leadership, Linux, Microservices, Networking, Security, Terraform","AWS Certified Solutions Architect - Professional, Google Professional Cloud Architect, Microsoft Certified: Azure Solutions Architect Expert"
Senior DevOps Architect,Leads DevOps initiatives at an architectural level by designing CI/CD pipelines and promoting automation across development teams.,"AWS, Ansible, Automation, Azure, CI/CD, Cloud Computing, Docker, Git, Google Cloud, Jenkins, Kubernetes, Leadership, Networking, Security, Terraform","AWS Certified DevOps Engineer - Professional, Google Professional Cloud DevOps Engineer, Certified Kubernetes Administrator (CKA)"
Senior DevOps Engineer,Drives DevOps initiatives at a senior level. Responsibilities include mentoring team members and implementing automation strategies.,"AWS, Ansible, Automation, Azure, CI/CD, Cloud Computing, Docker, Git, Jenkins, Kubernetes, Leadership, Linux, Networking, Python, Terraform","AWS Certified DevOps Engineer â Professional, Docker Certified Associate"
Senior DevSecOps Architect,Integrates security into DevOps practices at an architectural level by designing secure CI/CD pipelines and implementing security best practices.,"Ansible, CI/CD, Cloud Security, DevSecOps, Docker, Kubernetes, Leadership, Security Automation, Terraform, Vulnerability Management","Certified DevSecOps Professional (CDP), AWS Certified Security - Specialty, Certified Kubernetes Security Specialist (CKS)"
Senior SRE Architect,Leads SRE efforts at an architectural level by designing scalable/reliable systems while improving incident response strategies.,"Automation, CI/CD, Cloud Platforms, DevOps, Docker, Kubernetes, Leadership, Linux, Monitoring, Networking, Python, SRE","Google Professional Cloud DevOps Engineer, Certified Kubernetes Administrator (CKA), AWS Certified Solutions Architect - Professional"
Senior SRE Engineer,Drives site reliability efforts by implementing monitoring solutions and automating incident response. Responsible for improving service availability.,"Automation, CI/CD, Cloud Platforms, DevOps, Docker, Kubernetes, Leadership, Linux, Monitoring, Networking, Python, SRE","Google Professional Cloud DevOps Engineer, Certified Kubernetes Administrator (CKA), AWS Certified Solutions Architect - Professional"
Sharepoint Developer,Develops applications on SharePoint platform using technologies like .NET and JavaScript. Responsibilities include customizing SharePoint sites and building web parts.,".NET, C#, C++, Git, Java, JavaScript, OOP, PowerShell, Python, REST APIs, SharePoint, SharePoint Framework","Microsoft Certified: SharePoint Developer, Microsoft 365 Certified: Developer Associate"
Software Developer,"Develops software applications based on specifications provided by stakeholders. Responsibilities include coding, testing, debugging, and collaborating on projects.","Algorithms, C++, Data Structures, Debugging, Git, Java, OOP, Programming, Python, REST APIs, Software Development","Microsoft Certified: Azure Developer Associate, AWS Certified Developer - Associate, Oracle Certified Professional Java SE Developer"
Software Engineer,"Designs, develops, and tests software applications to meet business needs. Requires strong problem-solving skills and knowledge of software development methodologies.","Algorithms, C++, CI/CD, Cloud Computing, Data Structures, Git, Java, Jenkins, Python, Software Design","Microsoft Certified: Azure Developer Associate, AWS Certified Developer - Associate, Oracle Certified Professional Java SE Developer"
SonarQube Engineer,Manages SonarQube instance to measure/track code quality. Responsible for configuring quality profiles/gates while providing feedback to development teams.,".NET, CI/CD, Code Quality, Java, Security, SonarQube, Static Code Analysis","Certified Secure Software Lifecycle Professional (CSSLP), OWASP Top 10 Security Testing Certifications"
Splunk Engineer,"Implements Splunk solutions for log analysis, security monitoring, and operational intelligence. Responsible for creating dashboards/alerts and managing data ingestion.","AWS, Alerting, Azure, Dashboards, Data Analysis, Linux, Log Management, Scripting, Security, Splunk","Splunk Core Certified Power User, Splunk Enterprise Security Admin"
Splunk Enterprise Security Engineer,Manages Splunk Enterprise Security environment to detect/respond to security incidents. Requires expertise in threat detection techniques.,"Ethical Hacking, Firewalls, Incident Response, Linux, Network Security, Penetration Testing, Security Analysis, Security Information and Event Management (SIEM), Splunk Enterprise Security, Threat Detection","Splunk Core Certified User, Splunk Core Certified Power User, Splunk Enterprise Security Certified Admin"
SQL Developer,"Writes SQL code for database applications. Responsibilities include creating stored procedures, optimizing queries, and designing database schemas.","C++, Data Modeling, Database Design, ETL, Git, Java, OOP, Performance Tuning, Python, REST APIs, SQL, SQL Server, SSIS, SSRS, T-SQL","Microsoft Certified: Azure Data Engineer Associate, Oracle Database SQL Certified Associate"
SRE Architect,Designs Site Reliability Engineering strategies to improve system reliability while reducing operational overheads through automation.,"Automation, CI/CD, Cloud Architecture, Docker, Incident Management, Kubernetes, Monitoring, Networking, SRE","Google Professional Cloud DevOps Engineer, Certified Kubernetes Administrator (CKA), AWS Certified Solutions Architect - Professional"
SRE Engineer,"Implements Site Reliability Engineering practices by monitoring systems, responding to incidents, and automating operational tasks.","Automation, CI/CD, Cloud Platforms, DevOps, Docker, Kubernetes, Linux, Monitoring, Python, SRE","Google Professional Cloud DevOps Engineer, Certified Kubernetes Administrator (CKA), AWS Certified Solutions Architect - Professional"
SYSTEMS ADMINISTRATOR,"Manages computer systems within an organization. Responsibilities include configuring servers, troubleshooting issues, and ensuring system security.","Backup, Linux, Linux Administration, Networking, Scripting, Shell Scripting, Troubleshooting, Virtualization, Windows Server, Windows Server Administration","CompTIA Linux+, Red Hat Certified System Administrator (RHCSA), Microsoft Certified: Windows Server Hybrid Administrator Associate"
SYSTEMS ENGINEER,"Designs and implements IT systems that meet business requirements. Responsibilities include system integration, testing, and deployment.","Backup, Cloud Computing, Linux, Linux Administration, Networking, Shell Scripting, Systems Design, Virtualization, Windows Server, Windows Server Administration","CompTIA Server+, Microsoft Certified: Azure Solutions Architect Expert, Red Hat Certified Engineer (RHCE)"
TeamCity Engineer,Manages TeamCity CI/CD server by configuring build configurations/pipelines and integrating with source control systems.,"Build Automation, CI/CD, Git, TeamCity, Version Control","JetBrains TeamCity Certification (if available), AWS Certified DevOps Engineer - Professional"
Tech Sales Engineer,Supports sales efforts by providing technical expertise during presentations/demonstrations while answering questions about technical aspects.,"Customer Engagement, Networking Technologies, Product Knowledge, Technical Sales","AWS Certified Cloud Practitioner, Google Cloud Digital Leader, Microsoft Certified: Azure Fundamentals"
TECHNICAL ACCOUNT MANAGER,Manages relationships with technical customers while providing support/guidance on their technology needs. Acts as a liaison between customer/engineering teams.,"Account Management, Agile, Budgeting, Communication, Customer Relationship Management (CRM), Leadership, Project Management, Project Planning, Scrum, Technical Support","AWS Certified Solutions Architect - Associate, Google Professional Cloud Architect, Microsoft Certified: Azure Administrator Associate"
TECHNICAL LEAD,Leads technical teams on projects by providing guidance/mentorship while driving technical direction/decisions within projects.,"Agile Methodologies, Project Management, Software Development Lifecycle (SDLC), Team Leadership","AWS Certified Solutions Architect - Professional, Microsoft Certified: Azure Solutions Architect Expert, Google Professional Cloud Architect"
Terraform Engineer,Writes Terraform scripts to automate infrastructure provisioning across cloud platforms. Requires expertise in Infrastructure as Code (IaC) practices.,"AWS, Azure, Google Cloud, Infrastructure as Code (IaC), Terraform","HashiCorp Certified: Terraform Associate, AWS Certified DevOps Engineer - Professional"
TFS Engineer,Manages Team Foundation Server (TFS) to support software development processes. Responsibilities include configuring build pipelines and managing version control.,".NET Development Tools, .NET Framework, TFS (Team Foundation Server)","Microsoft Certified: DevOps Engineer Expert, Azure DevOps Solutions Certification"
UDeploy Engineer,Manages deployment processes using UrbanCode Deploy. Responsibilities include configuring deployment projects and automating release workflows.,"Automation, CI/CD, Deployment Strategies, UDeploy (UrbanCode Deploy), Version Control"," IBM UrbanCode Deploy Certification, AWS Certified DevOps Engineer - Professional"
UI DESIGNER,Designs user interfaces that are visually appealing while intuitive to use. Responsibilities include creating mockups/prototypes and conducting user research.,"Adobe Creative Suite, Adobe XD, CSS, Canva, Figma, HTML, Illustrator, JavaScript, Photoshop, Prototyping, UI Design Principles, User Testing, Wireframing","Google UX Design Professional Certificate, Nielsen Norman Group UX Certification, Adobe Certified Expert (ACE)"
UI Developer,"Develops user interfaces using HTML5, CSS3, JavaScript while focusing on responsive design principles. Collaborates with UI designers to implement designs.","Adobe XD, AngularJS, C++, CSS, CSS3, Figma, Git, HTML, HTML5, Java, JavaScript, OOP, Python, REST APIs, ReactJS, Responsive Design, Wireframing, jQuery","Meta Front-End Developer Certificate, AWS Certified Developer - Associate, React Nanodegree (Udacity)"
Unity Developer,Develops interactive content with Unity engine including 3D simulations while working with assets created by graphic designers,"3D Modeling, Animation, C#, C++, Game Development Principles, Git, Java, OOP, Python, REST APIs, Unity3D Engine","Unity Certified Associate: Game Developer, Unity Certified Expert Programmer"
UX DESIGNER,Conducts user research studies to gather insights on user behavior. Create wireframes/mockups based on data collected from research initiatives,"Canva, Design Thinking, Figma, Illustrator, Interaction Design, Photoshop, Prototyping, Usability Testing, User Experience Design Principles, User Research, Wireframing","Google UX Design Professional Certificate, Nielsen Norman Group UX Certification, Adobe Certified Expert (ACE)"
Vault Engineer,Implement secret management to the cloud application.,"Access Control, Cloud Security, Encryption, HashiCorp Vault, Secrets Management"," HashiCorp Certified: Vault Associate, AWS Certified Security - Specialty"
Web Designer (UI/UX Designer),"Create front end web application using HTML, Css, JS.","Adobe Creative Suite, Adobe XD, CSS, Canva, Design Thinking, Figma, HTML, Illustrator, JavaScript, Photoshop, Prototyping, UI/UX Design, Usability Testing, User Research, Wireframing","Google UX Design Certificate, Adobe Certified Expert (ACE), Nielsen Norman Group UX Certification"
Web Developer,"Develops and maintains websites and web applications. Responsibilities include writing code, debugging, and ensuring optimal performance across different browsers and devices.","AngularJS, C++, CSS3, Git, HTML5, Java, JavaScript, Node.js, OOP, PHP, Python, REST APIs, React","Meta Front-End Developer Certificate, AWS Certified Developer - Associate, Google Mobile Web Specialist"
WordPress Developer,"Creates and customizes WordPress websites. Responsibilities include developing themes/plugins, managing content, and ensuring website functionality.","C++, CSS3, Git, HTML5, Java, JavaScript, MySQL, OOP, PHP, Python, REST APIs, WordPress","Yoast SEO Certification, Google Mobile Sites Certification, WP Elevation Certification"
XL Deploy Engineer,"Manages deployment processes using XL Deploy. Responsibilities include configuring deployment pipelines, automating releases, and ensuring application availability.","CI/CD, Deployment Automation, Version Control, XL Deploy","XL Deploy Certification, DevOps Institute Certifications"
Zabbix Engineer,"Implements Zabbix monitoring solutions to track system performance and availability. Responsible for configuring alerts, dashboards, and monitoring metrics.","Alerting Systems, Monitoring Tools, Network Monitoring, Zabbix","Zabbix Certified Specialist, Zabbix Certified Professional"
ACCESSIBILITY SPECIALIST,"Ensures digital products meet accessibility standards, enhancing usability for all users.","CSS, HTML, JavaScript, User Experience Design, Web Accessibility Guidelines"," IAAP Certified Professional in Accessibility Core Competencies (CPACC), Web Accessibility Specialist (WAS)"
ADMIN BIG DATA,"Administers and manages large datasets, ensuring data integrity and accessibility.","AWS, Big Data Management, Data Warehousing, ETL, Excel, Hadoop, Hive, Kafka, Matplotlib, NumPy, Pandas, Power BI, Python, SQL, Scala, Seaborn, Spark, Tableau","Cloudera Certified Administrator (CCA), Google Cloud Professional Data Engineer"
AGILE PROJECT MANAGER,"Leads projects using agile frameworks, focusing on iterative development and team collaboration.","Agile, Agile Methodologies, Budgeting, Communication, Kanban, Leadership, Project Management Tools, Project Planning, Scrum","PMI Agile Certified Practitioner (PMI-ACP), Certified Scrum Master (CSM), SAFe Agilist Certification"
ANDROID DEVELOPER,"Develops mobile applications for Android devices, integrating features and ensuring user experience.","Android SDK, C++, Git, Java, Kotlin, Mobile App Development, OOP, Python, REST APIs, UI/UX Design","Google Associate Android Developer, Meta Android Developer Professional Certificate"
