Job Title,Job Description,Skills,Certifications
Admin Big Data,"Responsible for managing and overseeing big data infrastructure, ensuring data integrity, security, and availability. Requires expertise in Hadoop, Spark, and data warehousing solutions.","AWS, Azure, Big Data Architecture, Cloud Computing, Data Governance, Data Lakes, Data Modeling, Data Warehousing, ETL, Excel, Hadoop, Hive, Kafka, MapReduce, Matplotlib, NoSQL, NumPy, Pandas, Power BI, Python, SQL, Scala, Seaborn, Security, Spark, Tableau","Cloudera Certified Professional (CCP), Hortonworks Certified Associate (HCA), AWS Certified Big Data â Specialty"
Ansible Operations Engineer,"Focuses on automating IT processes using Ansible. Responsibilities include writing playbooks, managing configurations, and ensuring system reliability.","AWS, Ansible, Automation, CI/CD, Cloud Platforms, Docker, Infrastructure as Code, Kubernetes, Linux, Networking, Python, Scripting, Terraform","Red Hat Certified Specialist in Ansible Automation, AWS Certified DevOps Engineer â Professional"
Artifactory Administrator,"Manages the Artifactory repository for build artifacts. Responsibilities include configuring repositories, managing access permissions, and integrating with CI/CD pipelines.","Artifactory, Build Automation, CI/CD, Cloud Computing, Docker, Git, Gradle, JFrog CLI, Jenkins, Linux, Maven, Version Control","JFrog Artifactory Certification, DevOps Institute Certifications"
Artificial Intelligence / Machine Learning Leader,"Leads AI/ML projects and teams, defining strategy and overseeing implementation. Requires strong leadership skills and knowledge of AI technologies.","AI Strategy, Budgeting, Cloud Computing, Communication, Data Science, Deep Learning, Keras, Machine Learning, NumPy, Pandas, Project Management, Python, Scikit-learn, Stakeholder Management, Team Management, TensorFlow","AI-900: Microsoft Azure AI Fundamentals, Certified Artificial Intelligence Practitioner (CAIP)"
Artificial Intelligence / Machine Learning Sr.Leader,"Senior role overseeing multiple AI/ML initiatives. Responsible for strategic planning, team management, and ensuring alignment with business goals.","AI Strategy, Budgeting, Cloud Computing, Communication, Data Science, Deep Learning, Innovation, Keras, Machine Learning, Mentoring, NumPy, Pandas, Project Management, Python, Scikit-learn, Stakeholder Management, Team Management, TensorFlow","Certified Artificial Intelligence Practitioner (CAIP), AI-900: Microsoft Azure AI Fundamentals"
Artificial intelligence Architect,"Designs AI systems and architecture. Responsible for selecting appropriate technologies, ensuring scalability, and integrating AI solutions into existing systems.","AI Architecture, AWS, Azure, Cloud Computing, Data Science, Deep Learning, Machine Learning, Model Deployment, Scalability, Security, System Design","Google Cloud Professional Machine Learning Engineer, AWS Certified Solutions Architect â Professional"
Artificial Intelligence Researcher,Conducts research in AI to develop new algorithms and models. Publishes findings in scientific journals and collaborates with academic institutions.,"Algorithm Design, Data Analysis, Deep Learning, Machine Learning, PyTorch, Python, Research Methods, Scientific Writing, Statistical Analysis, TensorFlow","Certified Data Scientist (CDS), IEEE Certified Artificial Intelligence Engineer"
Big Data Architect,"Designs big data solutions and architecture. Responsible for data modeling, ETL processes, and ensuring the performance of big data systems.","AWS, Azure, Cloud Computing, Data Governance, Data Lakes, Data Modeling, Data Warehousing, ETL, Excel, Hadoop, Hive, Kafka, MapReduce, Matplotlib, NoSQL, NumPy, Pandas, Power BI, Python, SQL, Scala, Seaborn, Security, Spark, Tableau","Cloudera Certified Data Architect, AWS Certified Solutions Architect â Associate"
Big Data Engineer,"Builds and maintains big data pipelines. Responsible for data ingestion, transformation, and storage using technologies like Hadoop and Spark.","AWS, Cloud Computing, Data Pipelines, Data Warehousing, ETL, Excel, Hadoop, Hive, Java, Kafka, Matplotlib, NoSQL, NumPy, Pandas, Power BI, Python, SQL, Scala, Seaborn, Spark, Tableau","Google Cloud Professional Data Engineer, AWS Certified Big Data â Specialty"
Big Data Specialist,Analyzes large datasets to extract insights. Requires knowledge of statistical analysis tools and big data technologies.,"AWS, Cloud Computing, Data Analysis, Data Mining, Data Modeling, Data Visualization, ETL, Excel, Hadoop, Hive, Kafka, Matplotlib, NoSQL, NumPy, Pandas, Power BI, Python, SQL, Scala, Seaborn, Spark, Statistical Analysis, Tableau","Certified Big Data Analytics (CBDA), IBM Certified Data Engineer - Big Data"
Build and Release Engineer,"Manages the build process for software applications. Responsible for automating builds, managing release schedules, and ensuring software quality.","Adobe XD, Automation, Build Tools, CI/CD, CSS, Docker, Figma, Git, Gradle, HTML, JavaScript, Jenkins, Kubernetes, Linux, Maven, Scripting, Wireframing","Certified Jenkins Engineer, AWS Certified DevOps Engineer â Professional"
Build Engineer,Focuses on building software applications from source code. Responsibilities include configuring build environments and troubleshooting build issues.,"Adobe XD, Ant, Build Automation, CI/CD, CSS, Figma, Git, Gradle, HTML, JavaScript, Jenkins, Linux, Maven, Scripting, Version Control, Wireframing","AWS Certified Developer â Associate, Jenkins Certification"
Chef Operations Engineer,"Utilizes Chef for configuration management. Responsible for writing cookbooks, managing infrastructure as code, and automating deployment processes.","AWS, Automation, Azure, Chef, Cloud Computing, Configuration Management, Infrastructure as Code, Linux, Ruby","Chef Certification, AWS Certified DevOps Engineer â Professional"
Data Analysts,"Analyzes datasets to provide actionable insights. Requires proficiency in SQL, Excel, and data visualization tools like Tableau or Power BI.","Data Cleansing, Data Mining, Data Modeling, Data Visualization, ETL, Excel, Matplotlib, NumPy, Pandas, Power BI, Python, R, SQL, Seaborn, Statistics, Tableau","Microsoft Certified: Data Analyst Associate, Tableau Desktop Specialist"
Data Architect,"Designs data models and architecture for databases. Responsible for ensuring data quality, integrity, and security across systems.","AWS, Azure, Cloud Computing, Data Governance, Data Integration, Data Modeling, Data Security, Data Warehousing, ETL, Excel, Matplotlib, NoSQL, NumPy, Pandas, Power BI, Python, SQL, Seaborn, Tableau","IBM Certified Data Architect - Big Data, Google Cloud Professional Data Architect"
DevOps Architect,Designs DevOps frameworks that enhance collaboration between development/operations teams while implementing CI/CD practices.,"AWS, Ansible, Automation, Azure, CI/CD, Cloud Computing, Docker, Git, Google Cloud, Jenkins, Kubernetes, Networking, Security, Terraform","AWS Certified Solutions Architect â Professional, Google Cloud Professional DevOps Engineer"
DevOps Engineer,Implements DevOps practices by automating software delivery processes using tools like Jenkins or GitLab CI.,"AWS, Ansible, Automation, Azure, CI/CD, Cloud Computing, Docker, Git, Jenkins, Kubernetes, Linux, Networking, Python, Scripting, Terraform","AWS Certified DevOps Engineer â Professional, Docker Certified Associate"
ELK Engineer,"Implements ELK stack (Elasticsearch, Logstash, Kibana) solutions for log management/analysis while creating visualizations/dashboards.","AWS, Azure, Data Visualization, Elasticsearch, Kibana, Linux, Log Management, Logstash, Networking, Security","Elastic Certified Engineer, Elastic Stack Certification"
Gerrit Administrator,"Administers Gerrit code review tool. Responsibilities include managing user access, configuring project settings, and facilitating code reviews.","Automation, Code Review, Gerrit, Git, Linux, Scripting, Version Control",Gerrit Code Review Certification (if available)
Jenkins Engineer,Manages Jenkins CI/CD server to automate software builds/deployments. Responsibilities include configuring jobs/plugins and maintaining build pipelines.,"Automation, Build Automation, CI/CD, Docker, Groovy, Jenkins, Kubernetes, Linux, Scripting, Version Control","Certified Jenkins Engineer, AWS Certified DevOps Engineer â Professional"
Jira Administrator,"Manages Jira project management tool. Responsibilities include configuring workflows, managing user permissions, and supporting teams in Agile methodologies.","Agile Methodologies, Atlassian Suite, Jira, Project Management, User Management, Workflow Configuration","Atlassian Jira Administration Certification, AgilePM Certification"
Kubernetes Operations Engineer,"Manages Kubernetes clusters for container orchestration. Responsibilities include deploying applications, monitoring cluster health, and troubleshooting issues.","AWS, Automation, Azure, CI/CD, Cloud Computing, Docker, Kubernetes, Linux, Networking, Security","Certified Kubernetes Administrator (CKA), CNCF Kubernetes Security Specialist (CKS)"
Machine learning Architect,"Designs machine learning systems architecture. Responsible for selecting appropriate frameworks, designing workflows, and ensuring scalability of ML models.","AWS, Azure, Cloud Computing, Data Science, Deep Learning, Keras, Machine Learning, Model Deployment, NumPy, Pandas, Python, Scalability, Scikit-learn, Security, System Design, TensorFlow","Google Cloud Professional Machine Learning Engineer, AWS Certified Machine Learning â Specialty"
Machine Learning Engineer,Builds machine learning models by implementing algorithms/data processing techniques while focusing on model evaluation/deployment.,"Algorithms, Computer Vision, Data Analysis, Data Science, Deep Learning, Keras, Machine Learning, Natural Language Processing, NumPy, Pandas, PyTorch, Python, Scikit-learn, TensorFlow","Microsoft Certified: Azure Data Scientist Associate, TensorFlow Developer Certificate"
Operations Engineer,"Oversees IT operations to ensure system reliability. Responsibilities include monitoring system performance, troubleshooting issues, and implementing improvements.","Automation, Cloud Computing, Linux, Monitoring, Networking, Scripting, System Administration, Troubleshooting, Windows Server","ITIL Foundation Certification, CompTIA IT Fundamentals+"
Principle Engineer in Artificial Intelligence,"Leads AI initiatives within an organization. Responsibilities include strategic planning, mentoring teams, and driving innovation in AI technologies.","AI Strategy, Cloud Computing, Data Science, Deep Learning, Innovation, Machine Learning, Mentoring, Python, System Design, TensorFlow","AI-900: Microsoft Azure AI Fundamentals, Certified Artificial Intelligence Practitioner (CAIP)"
Principle Engineer in Big Data,Senior role responsible for big data strategy implementation. Oversees architecture design decisions and ensures compliance with best practices.,"AWS, Big Data Architecture, Cloud Computing, Data Governance, Data Warehousing, ETL, Excel, Hadoop, Hive, Innovation, Kafka, Matplotlib, Mentoring, NumPy, Pandas, Power BI, Python, SQL, Scala, Seaborn, Spark, Tableau","Cloudera Certified Professional (CCP), Google Cloud Professional Data Engineer"
Principle Engineer in Data Analysis,Leads data analysis projects to derive insights from complex datasets. Requires strong analytical skills and experience with statistical methods.,"Data Analysis, Data Modeling, Data Visualization, Excel, Innovation, Matplotlib, Mentoring, NumPy, Pandas, Power BI, Python, SQL, Seaborn, Statistics, Tableau","Certified Analytics Professional (CAP), Microsoft Certified: Data Analyst Associate"
Principle Engineer in Machine Learning,Senior role overseeing machine learning projects. Responsible for guiding teams on best practices in model development and deployment.,"Cloud Computing, Deep Learning, Innovation, Keras, Machine Learning, Mentoring, Model Deployment, NumPy, Pandas, Python, Scikit-learn, TensorFlow","Google Cloud Professional Machine Learning Engineer, AWS Certified Machine Learning â Specialty"
Production Support Engineer,"Provides support for production systems to ensure uptime. Responsibilities include monitoring applications, troubleshooting issues, and performing root cause analysis.","Agile, Automation, Databases, ITIL, Linux, Market Research, Monitoring, Networking, Roadmaps, Scripting, Stakeholder Management, Troubleshooting, Windows Server","ITIL Foundation Certification, CompTIA A+"
Puppet Operations Engineer,Utilizes Puppet for configuration management tasks. Responsible for writing manifests/scripts to automate system configurations across environments.,"AWS, Automation, Azure, Cloud Computing, Configuration Management, Infrastructure as Code, Linux, Puppet, Ruby","Puppet Certification, AWS Certified DevOps Engineer â Professional"
Senior Build and Release Engineer,Leads build/release engineering efforts within an organization. Manages complex build environments while ensuring timely delivery of software releases.,"Adobe XD, Automation, Build Tools, CI/CD, CSS, Docker, Figma, Git, Gradle, HTML, JavaScript, Jenkins, Kubernetes, Leadership, Linux, Maven, Mentoring, Scripting, Wireframing","Certified Jenkins Engineer, AWS Certified DevOps Engineer â Professional"
Senior Build Engineer,Oversees build processes for software projects at a senior level. Responsible for optimizing build times and maintaining build infrastructure.,"Adobe XD, Ant, Build Automation, CI/CD, CSS, Figma, Git, Gradle, HTML, JavaScript, Jenkins, Leadership, Linux, Maven, Mentoring, Scripting, Version Control, Wireframing","Jenkins Certification, AWS Certified Developer â Associate"
Senior DevOps Engineer,Drives DevOps initiatives at a senior level. Responsibilities include mentoring team members and implementing automation strategies.,"AWS, Ansible, Automation, Azure, CI/CD, Cloud Computing, Docker, Git, Jenkins, Kubernetes, Leadership, Linux, Networking, Python, Terraform","AWS Certified DevOps Engineer â Professional, Docker Certified Associate"
Site Reliability Engineer (Kubernetes â Docker),Focuses on maintaining high availability of containerized applications using Kubernetes/Docker while implementing SRE best practices.,"Automation, CI/CD, Cloud Computing, Docker, Kubernetes, Linux, Monitoring, Networking, SRE, Troubleshooting","Certified Kubernetes Administrator (CKA), Docker Certified Associate"
Splunk Engineer,"Implements Splunk solutions for log analysis, security monitoring, and operational intelligence. Responsible for creating dashboards/alerts and managing data ingestion.","AWS, Alerting, Azure, Dashboards, Data Analysis, Linux, Log Management, Scripting, Security, Splunk","Splunk Core Certified Power User, Splunk Enterprise Security Admin"
.NET Developer,Develops applications using .NET framework technologies including C#. Responsibilities include application design/development/testing.,".NET, ASP.NET, C#, C++, Cloud Computing, Entity Framework, Git, Java, LINQ, MVC, OOP, Python, REST APIs, SQL Server, Web API","Microsoft Certified: .NET Developer, MCP: Programming in C#"
ACCESSIBILITY SPECIALIST,"Ensures digital content meets accessibility standards (e.g., WCAG). Conducts audits/reviews to improve accessibility compliance.","ADA Compliance, ARIA, Accessibility Testing, Assistive Technologies, CSS, HTML, JavaScript, UI/UX, WCAG","IAAP CPACC, W3C Web Accessibility Specialist"
AGILE PROJECT MANAGER,"Manages Agile projects by facilitating Scrum ceremonies (e.g., sprint planning). Ensures team adherence to Agile principles/methodologies.","Agile, Agile Methodologies, Budgeting, Communication, Confluence, Jira, Kanban, Leadership, Project Management, Project Planning, Scrum, Stakeholder Management","Project Management Professional (PMP), Certified ScrumMaster (CSM)"
Android Developer,Develops mobile applications using Android SDK/Java/Kotlin technologies while focusing on UI/UX design principles.,"Android SDK, Android Studio, C++, Firebase, Git, Java, Kotlin, Mobile Development, OOP, Python, REST APIs, SQL, UI/UX Design","Associate Android Developer, Google Play Store Certification"
Ansible Automation Engineer,Automates IT tasks using Ansible playbooks/scripts while managing configurations across environments.,"AWS, Ansible, Automation, Azure, Cloud Computing, Infrastructure as Code, Linux, Networking, Python, Scripting","Red Hat Ansible Automation Certification, AWS Certified DevOps Engineer - Professional"
AppDynamics Engineer,Monitors application performance using AppDynamics tools while providing insights into application health/performance metrics.,".NET, Alerting, AppDynamics, Application Performance Monitoring, Cloud Computing, Java, Metrics, Troubleshooting","AppDynamics Certification, Cisco Application Centric Infrastructure (ACI)"
Application Security Engineer,Focuses on securing applications through vulnerability assessments/pentesting while implementing security best practices.,"Application Security, Cloud Security, DAST, Ethical Hacking, Firewalls, Linux, Network Security, OWASP, Penetration Testing, SAST, Secure Coding, Vulnerability Management","Certified Information Systems Security Professional (CISSP), Certified Ethical Hacker (CEH)"
Artifactory Engineer,Manages Artifactory repositories while integrating them into CI/CD pipelines to ensure efficient artifact management.,"Artifactory, Build Automation, CI/CD, Cloud Computing, Docker, Git, Gradle, Jenkins, Linux, Maven, Version Control","JFrog Artifactory Certification, DevOps Institute Certifications"
AWS DevOps Engineer,Implements DevOps practices on AWS platform while utilizing services like EC2/S3/Lambda to automate deployments.,"AWS, Ansible, Automation, CI/CD, CloudFormation, DevOps, Docker, Git, Jenkins, Kubernetes, Linux, Scripting, Terraform","AWS Certified DevOps Engineer - Professional, Docker Certified Associate"
AWS Solutions Architect,Designs scalable cloud architectures on AWS platform while providing guidance on best practices/security compliance.,"AWS, AWS Lambda, Cloud Architecture, Cloud Security, CloudFormation, DevOps, EC2, Networking, S3, Security, Terraform","AWS Certified Solutions Architect - Associate, AWS Certified Solutions Architect - Professional"
Azure DevOps Engineer,Implements DevOps solutions on Azure platform while utilizing Azure DevOps services/tools to automate deployments.,"ARM Templates, AWS, Ansible, Automation, Azure, CI/CD, DevOps, Docker, Git, Jenkins, Kubernetes, Linux, Scripting, Terraform","Microsoft Certified: Azure DevOps Solutions Expert, Azure Fundamentals"
Bamboo Engineer,"Manages CI/CD processes using Bamboo. Responsibilities include configuring build plans, integrating with version control systems, and ensuring smooth deployment pipelines.","Atlassian Suite, Automation, Bamboo, Build Automation, CI/CD, Git, Scripting, Version Control","Atlassian Bamboo Certification, CI/CD Certifications"
Bitbucket Engineer,"Administers Bitbucket repositories for version control. Responsible for managing user permissions, branch strategies, and pull requests.","Atlassian Suite, Bitbucket, Branching Strategies, CI/CD, Code Review, Git, Version Control","Atlassian Bitbucket Certification, GitHub Proficiency Certifications"
Blockchain Developer,Develops blockchain-based applications and smart contracts. Requires knowledge of blockchain frameworks such as Ethereum and programming languages like Solidity.,"Blockchain, C++, Consensus Algorithms, Cryptocurrency, Deep Learning, Distributed Ledger, Ethereum, Git, Java, JavaScript, Neural Networks, Node.js, OOP, PyTorch, Python, REST APIs, Smart Contracts, Solidity, TensorFlow, Web3","Certified Blockchain Developer, Ethereum Developer Certification"
BUSINESS SYSTEMS ANALYST,Analyzes business needs and translates them into technical requirements. Works closely with stakeholders to improve processes and implement technology solutions.,"BPMN, Backup, Business Analysis, Data Analysis, Linux, Process Improvement, Requirements Gathering, SQL, Shell Scripting, Stakeholder Management, UML, Virtualization, Windows Server","CBAP - Certified Business Analysis Professional, PMI-PBA - PMI Professional in Business Analysis"
C# Developer,"Develops applications using C# and .NET technologies. Responsibilities include designing, coding, testing, and debugging software applications.",".NET, ASP.NET, C#, C++, Cloud Computing, Entity Framework, Git, Java, LINQ, MVC, OOP, Python, REST APIs, SQL Server, Web API","Microsoft Certified: C# Programmer, .NET Framework Certification"
Chef InSpec Engineer,Utilizes Chef InSpec for compliance automation. Responsible for writing tests to ensure systems meet security and compliance standards.,"Automation, Chef InSpec, Cloud Computing, Compliance as Code, Configuration Management, Linux, Security","Chef InSpec Certification, HashiCorp Terraform Associate"
Cloud administrator,No description available,"AWS, Automation, Azure, Cloud Computing, Docker, GCP, Google Cloud, Kubernetes, Linux, Networking, Scripting, Security, Terraform, Virtualization","CompTIA Cloud+, Cloud Security Alliance CCSK"
CLOUD ARCHITECT,Designs cloud architecture solutions to meet business requirements. Responsible for selecting appropriate cloud services and ensuring scalability/security.,"AWS, Automation, Azure, CI/CD, Cloud Architecture, Cloud Security, Docker, GCP, Google Cloud, Kubernetes, Linux, Microservices, Networking, Terraform","Google Cloud Professional Cloud Architect, AWS Certified Solutions Architect"
Cloud automation engineer,Automates cloud infrastructure management using tools like Terraform or Ansible. Focuses on deploying resources efficiently across cloud environments.,"AWS, Ansible, Automation, Azure, CI/CD, Cloud Computing, Docker, GCP, Google Cloud, Kubernetes, Linux, Networking, Python, Scripting, Terraform","HashiCorp Terraform Associate, Azure Automation Certifications"
Cloud engineer,"Builds and maintains cloud infrastructure. Responsibilities include configuring cloud services, optimizing performance, and ensuring security compliance.","AWS, Automation, Azure, Cloud Computing, Docker, GCP, Google Cloud, Kubernetes, Linux, Networking, Scripting, Security, Terraform, Virtualization","Google Cloud Associate Cloud Engineering, CompTIA Cloud+"
Cloud network engineer,"Designs and manages networking solutions within cloud environments. Focuses on VPCs, subnets, routing configurations, and security groups.","AWS, Azure, CCNA, Cloud Networking, Docker, Firewalls, GCP, Google Cloud, Kubernetes, Linux, Networking, Routers, Routing, Security Groups, Subnets, Switches, Terraform, VPC","Cisco CCNA Cloud, Cisco CCNP Cloud"
Cloud Security Engineer,"Implements security measures for cloud environments. Responsibilities include identity management, data protection, and compliance auditing.","AWS, Azure, Cloud Security, Compliance, Docker, Encryption, Ethical Hacking, Firewalls, GCP, IAM, Identity and Access Management, Kubernetes, Linux, Network Security, Networking, Penetration Testing, Terraform, Vulnerability Management","Certified Cloud Security Professional (CCSP), CompTIA Security+"
CNC Programmer,Creates CNC programs for machining operations. Responsible for interpreting blueprints and optimizing tool paths for efficiency.,"Blueprints, CAD/CAM, CNC Programming, G-Code, Machining, Manufacturing Processes, Toolpath Optimization","CNC Programming Certificate, Mastercam Certification"
Coder,Writes code in various programming languages to develop software applications. Responsibilities include debugging and maintaining code quality.,"Algorithms, Data Structures, Debugging, Problem Solving, Programming, Software Development","CompTIA IT Fundamentals+, Coding Bootcamp Certificates"
COMPUTER GRAPHICS ANIMATOR,"Creates animations using computer graphics software. Responsibilities include modeling, rigging, and rendering 3D assets.","2D Animation, 3D Animation, Adobe Creative Suite, Blender, Maya, Motion Graphics, Storyboarding, Visual Effects","Adobe Creative Suite Certifications, Maya Certifications"
Computer Hardware Engineer,"Designs and tests hardware components for computers. Responsibilities include circuit design, prototyping, and troubleshooting hardware issues.","Circuit Design, Embedded Systems, Hardware Design, Microprocessors, PCB Design, Testing, Validation","CompTIA A+, Cisco CCNA"
Computer Network Architect,Designs network infrastructures to support organizational needs. Responsible for selecting hardware/software solutions to optimize network performance.,"CCNA, Cloud Networking, Firewalls, LAN/WAN, Linux, Network Design, Networking, Routers, Routing, Security, Switches, Switching, TCP/IP, VPN","Cisco CCNP Network Design, Cisco CCIE Routing and Switching"
Computer Programmer,Writes code to create software applications based on specifications. Responsibilities include debugging code and collaborating with other developers.,"Algorithms, C++, Data Structures, Debugging, Java, Programming, Python, Software Development","Oracle Java Programmer Certification, Microsoft Technology Associate (MTA)"
Computer Research Scientist,Conducts research in computing fields to develop new technologies or methodologies. Publishes findings in academic journals and presents at conferences.,"Algorithms, Data Analysis, Machine Learning, Programming, Publications, Research Methods, Scientific Writing","Certified Data Scientist (CDS), IEEE Certified Artificial Intelligence Engineer"
