Job Title,Job Description,Skills,Certifications
MAVEN ENGINEER,Configures and manages Maven for build automation in Java projects.,"Build Automation, Java, Maven, Software Configuration Management","No direct certification; recommended: Apache Maven Fundamentals, Oracle Certified Professional - Java"
MOBILE APP DEVELOPER,Develops mobile applications for iOS and Android platforms.,"C++, Git, Java, Mobile App Development, OOP, Programming Languages, Python, REST APIs, UI/UX Design, iOS/Android SDKs","Google Associate Android Developer, Apple Certified iOS Developer"
MULESOFT DEVELOPER,Develops and integrates applications using the MuleSoft Anypoint Platform.,"API Integration, C++, Git, Integration Patterns, Java, MuleSoft Anypoint Platform, OOP, Python, REST APIs",MuleSoft Certified Developer - Level 1
NAGIOS ENGINEER,Configures and manages Nagios for system and network monitoring.,"Linux, Nagios, Networking, System Monitoring",Nagios Certified Administrator
NETWORK AND SYSTEMS ADMINISTRATOR,Manages and maintains network and server infrastructure.,"Backup, CCNA, Firewalls, Linux, Linux/Windows Servers, Networking, Routers, Shell Scripting, Switches, System Administration, Troubleshooting, Virtualization, Windows Server","Cisco Certified Network Associate (CCNA), CompTIA Network+"
NETWORK ENGINEER,"Designs, implements, and manages network infrastructure.","CCNA, Cisco/Juniper Devices, Firewalls, Linux, Network Security, Networking, Networking Protocols, Routers, Switches, Troubleshooting"," Cisco Certified Network Professional (CCNP), Juniper Networks Certified Associate (JNCIA)"
NEW RELIC ENGINEER,Configures and manages New Relic for application performance monitoring.,"Application Performance Monitoring, Cloud Computing, New Relic, Troubleshooting",New Relic Performance Monitoring Certification
NEXUS ENGINEER,Manages and configures Nexus Repository Manager for artifact storage and retrieval.,"Artifact Management, DevOps Practices, Nexus Repository Manager",No direct certification; recommended: Sonatype Nexus Administration Training
NOMAD ENGINEER,Configures and manages Nomad for container orchestration and infrastructure automation.,"Container Orchestration, HashiCorp Tools, Infrastructure Automation, Nomad",HashiCorp Certified: Nomad Associate
NOTARY ENGINEER,Implements and manages Notary for ensuring container image security.,"Container Security, Cryptography, Docker, Notary",No direct certification; recommended: Certified Kubernetes Security Specialist (CKS)
OCTOPUS DEPLOY ENGINEER,Configures and manages Octopus Deploy for automating application deployments.,".NET, Deployment Automation, Octopus Deploy, PowerShell","No direct certification; recommended: Certified Jenkins Engineer (CJE), CI/CD Pipelines Specialist"
OPENSHIFT ENGINEER,Manages and configures OpenShift for container orchestration and application deployment.,"Containerization, DevOps Practices, Kubernetes, OpenShift", Red Hat Certified Specialist in OpenShift Administration
OPENSTACK ENGINEER,Implements and manages OpenStack cloud infrastructure.,"Cloud Computing, OpenStack, System Administration, Virtualization", Certified OpenStack Administrator (COA)
OPERATIONS ENGINEER,"Manages and maintains systems and infrastructure, ensuring reliable operation.","Linux/Windows Servers, Scripting, System Administration, Troubleshooting","ITIL 4 Foundation, AWS Certified SysOps Administrator"
ORACLE DEVELOPER,Develops database applications using Oracle technologies.,"C++, Database Development, Git, Java, OOP, Oracle Database, PL/SQL, Python, REST APIs, SQL","Oracle Certified Professional (OCP) - Java SE, Oracle Database SQL Certified Associate"
ORACLE SQL DEVELOPER,Develops and optimizes SQL queries and database schemas in Oracle environments.,"C++, Data Modeling, Database Design, Git, Java, OOP, Oracle SQL, PL/SQL, Python, REST APIs",Oracle Database SQL Certified Associate
PACKER ENGINEER,Creates machine images using Packer for consistent infrastructure deployment.,"Automation, Cloud Computing, Infrastructure as Code, Packer",HashiCorp Certified: Packer Associate
PHP DEVELOPER,Develops web applications using PHP and related technologies.,"C++, Frameworks (Laravel, Git, Java, MySQL, OOP, PHP, Python, REST APIs, Symfony), Web Development","Zend Certified PHP Engineer, AWS Certified Developer - Associate"
POWERSHELL ENGINEER,Develops automation scripts and tools using PowerShell for Windows environments.,"Automation, PowerShell, Scripting, Windows Server Administration","Microsoft Certified: Power Platform Developer Associate, Microsoft Certified: Azure Administrator Associate"
PRINCIPLE ENGINEER IN ARTIFICIAL INTELLIGENCE,"Leads and designs AI/ML solutions, providing technical guidance and strategic direction.","AI/ML Architecture, Deep Learning, Leadership, Strategic Planning","TensorFlow Developer Certificate, AWS Certified Machine Learning - Specialty, Google Professional Data Engineer"
PRINCIPLE ENGINEER IN BIG DATA,"Leads and designs big data solutions, providing technical expertise and guidance.","AWS, Big Data Architecture, Data Warehousing, ETL, Excel, Hadoop, Hive, Kafka, Matplotlib, NumPy, Pandas, Power BI, Python, SQL, Scala, Seaborn, Spark, Tableau","Google Professional Data Engineer, AWS Certified Big Data - Specialty"
PRINCIPLE ENGINEER IN DATA ANALYSIS,"Leads data analysis initiatives, providing expertise and guidance on analytical techniques.","Data Analysis, Data Visualization, Excel, Leadership, Matplotlib, NumPy, Pandas, Power BI, Python, SQL, Seaborn, Statistical Modeling, Tableau","Microsoft Certified: Azure Data Scientist Associate, Google Data Analytics Professional Certificate"
PRINCIPLE ENGINEER IN MACHINE LEARNING,"Leads machine learning initiatives, providing expertise and guidance on model development and deployment.","Deployment, Keras, Leadership, Machine Learning Algorithms, Model Development, NumPy, Pandas, Python, Scikit-learn, TensorFlow","TensorFlow Developer Certificate, Microsoft Certified: Azure AI Engineer Associate"
PRODUCT MANAGER,"Defines and manages product strategy, gathering requirements and prioritizing features.","Agile, Budgeting, Communication, Leadership, Market Analysis, Market Research, Product Roadmap, Product Strategy, Project Planning, Requirements Gathering, Roadmaps, Scrum, Stakeholder Management"," Certified Scrum Product Owner (CSPO), PMI Agile Certified Practitioner (PMI-ACP)"
PRODUCTION SUPPORT ENGINEER,"Provides technical support for production systems, resolving incidents and ensuring stability.","Agile, Incident Management, Market Research, Roadmaps, Stakeholder Management, System Monitoring, Technical Support, Troubleshooting"," ITIL 4 Foundation, AWS Certified SysOps Administrator"
PUPPET OPERATIONS ENGINEER,Manages and automates infrastructure configuration using Puppet.,"Automation, Configuration Management, Infrastructure as Code, Puppet"," ITIL 4 Foundation, AWS Certified SysOps Administrator"
SENIOR BUILD AND RELEASE ENGINEER,"Manages build and release processes, ensuring smooth and reliable software deployments.","Adobe XD, Automation, Build Systems, CI/CD Pipelines, CSS, Configuration Management, Figma, HTML, JavaScript, Wireframing",Puppet Certified Professional
SENIOR BUILD ENGINEER,"Develops and maintains build systems, automating software compilation and testing.","Adobe XD, Automation, Build Systems, CSS, Figma, HTML, JavaScript, Scripting, Software Configuration Management, Wireframing","Certified Jenkins Engineer (CJE), AWS Certified DevOps Engineer - Professional"
SENIOR DEVOPS ENGINEER,"Leads DevOps initiatives, designing and implementing automation solutions.","AWS, Automation, CI/CD, Cloud Computing, DevOps Practices, Docker, Git, Jenkins, Kubernetes, System Architecture, Terraform","Certified Jenkins Engineer (CJE), Kubernetes Certified Administrator (CKA)"
SITE RELIABILITY ENGINEER (KUBERNETES Ãâ¬Ã¯Â¿Â½ DOCKER),Ensures the reliability and performance of systems running on Kubernetes and Docker.,"Automation, Docker, Kubernetes, Monitoring, System Reliability","AWS Certified DevOps Engineer - Professional, Kubernetes Certified Administrator (CKA)"
SPLUNK ENGINEER,"Configures and manages Splunk for log analysis, monitoring, and security insights.","Data Analysis, Log Management, Splunk, System Monitoring","Kubernetes Certified Administrator (CKA), Docker Certified Associate"
XL DEPLOY ENGINEER,Configures and manages XL Deploy for automating application deployments.,"Configuration Management, Deployment Automation, DevOps Practices, XL Deploy","Splunk Core Certified User, Splunk Enterprise Certified Admin"
ZABBIX ENGINEER,"Configures and manages Zabbix for monitoring systems, networks, and applications.","Alerting, Network Monitoring, System Monitoring, Zabbix","No direct certification; recommended: Kubernetes Certified Administrator (CKA), CI/CD Pipelines Specialist"
API DEVELOPER,Develops and implements APIs for integrating systems and applications.,"API Design, C++, Git, Java, OOP, Programming Languages, Python, REST APIs, RESTful Services, Security",Zabbix Certified Specialist
AUTOMATION SPECIALIST,Designs and implements automation solutions to improve efficiency and reduce manual effort.,"Automation Tools, Process Improvement, Scripting, Testing","Google Apigee Certification, AWS Certified Developer - Associate"
BUSINESS INTELLIGENCE ANALYST,Analyzes data to provide insights and support business decision-making.,"Business Acumen, Data Analysis, Data Visualization, SQL","UiPath Certified Professional, Automation Anywhere Certified Advanced RPA Professional"
CLOUD MIGRATION SPECIALIST,"Plans and executes cloud migration projects, ensuring smooth transitions.","AWS, Azure, Cloud Platforms, Docker, GCP, Kubernetes, Linux, Migration Tools, Networking, Project Management, System Migration, Terraform","Microsoft Certified: Power BI Data Analyst Associate, Tableau Desktop Specialist"
CYBERSECURITY ANALYST,Protects computer systems and networks from cyber threats.,"Compliance, Cybersecurity, Ethical Hacking, Firewalls, IDS/IPS, Incident Response, Linux, Network Security, Penetration Testing, Risk Analysis, SIEM, Security Protocols, Threat Analysis, Vulnerability Scanning","AWS Certified Solutions Architect - Associate, Google Professional Cloud Architect"
DATA QUALITY ENGINEER,"Ensures data quality by profiling, monitoring, and improving data accuracy and consistency.","Data Governance, Data Profiling, Data Quality Tools, Excel, Matplotlib, NumPy, Pandas, Power BI, Python, SQL, Seaborn, Tableau","CompTIA Security+, Certified Information Systems Security Professional (CISSP)"
DIGITAL TRANSFORMATION CONSULTANT,"Advises organizations on digital transformation initiatives, driving innovation and efficiency.","Business Process Improvement, Change Management, Digital Strategy, Technology Consulting","Certified Data Management Professional (CDMP), Microsoft Certified: Azure Data Engineer Associate"
E-COMMERCE DEVELOPER,Develops and maintains e-commerce websites and applications.,"C++, E-Commerce Platforms, Git, Java, OOP, Payment Gateways, Python, REST APIs, Security, Web Development","TOGAF Certified Enterprise Architect, PMI Agile Certified Practitioner (PMI-ACP)"
EMBEDDED SYSTEMS ENGINEER,"Develops software for embedded systems, integrating hardware and software components.","Backup, C/C++, Embedded Systems, Firmware Development, Hardware Interfaces, Linux, Shell Scripting, Virtualization, Windows Server","Magento Certified Developer, Shopify Partner Academy Certification"
ERP CONSULTANT,"Consults on ERP system implementation, customization, and support.","Business Process Analysis, ERP Systems, Implementation, Training","Arm Certified Embedded Systems Engineer, Certified LabVIEW Developer"
GEOGRAPHIC INFORMATION SYSTEMS (GIS) ANALYST,Analyzes spatial data using GIS software to create maps and provide insights.,"Backup, Cartography, Data Visualization, GIS Software, Linux, Shell Scripting, Spatial Analysis, Virtualization, Windows Server","SAP Certified Application Associate, Oracle ERP Cloud Certification"
HELP DESK TECHNICIAN,"Provides technical support to end-users, resolving hardware and software issues.","Customer Service, Hardware/Software, Technical Support, Troubleshooting","Esri GIS Certification, GISP (Certified GIS Professional)"
IDENTITY AND ACCESS MANAGEMENT SPECIALIST,"Manages identity and access control systems, ensuring secure access to resources.","Authentication, Authorization, IAM Systems, Security Protocols","CompTIA A+, Microsoft 365 Certified: Modern Desktop Administrator Associate"
INFRASTRUCTURE ARCHITECT,"Designs and plans IT infrastructure, ensuring scalability, reliability, and security.","Cloud Computing, Networking, Security, System Architecture","Certified Identity and Access Manager (CIAM), Okta Certified Professional"
INTERNET OF THINGS (IoT) DEVELOPER,"Develops applications for IoT devices and platforms, connecting devices and analyzing data.","C++, Embedded Systems, Git, IoT Platforms, Java, OOP, Programming Languages, Python, REST APIs, Sensor Technology","AWS Certified Solutions Architect - Professional, Google Professional Cloud Architect"
IT AUDITOR,Conducts IT audits to ensure compliance and identify security risks.,"Compliance, IT Auditing, Risk Management, Security","Microsoft Certified: Azure IoT Developer Specialty, AWS Certified IoT Specialty"
JAVA ARCHITECT,"Designs and leads the development of Java-based systems, ensuring scalability and maintainability.","Cloud Computing, Design Patterns, Hibernate, JDBC, Java, Maven, Spring Boot, System Architecture",Certified Information Systems Auditor (CISA)
LINUX ADMINISTRATOR,"Manages and maintains Linux servers, ensuring system stability and security.","Design Thinking, Linux Servers, Prototyping, Scripting, System Administration, Troubleshooting, Usability Testing, User Research",Oracle Certified Master (OCM) - Java EE Enterprise Architect
MAINFRAME DEVELOPER,Develops and maintains applications on mainframe systems.,"C++, COBOL, Deep Learning, Git, JCL, Java, Mainframe Systems, Neural Networks, OOP, PyTorch, Python, REST APIs, TensorFlow, VSAM","Red Hat Certified System Administrator (RHCSA), Linux Professional Institute Certification (LPIC-1)"
MICROSOFT DYNAMICS DEVELOPER,Develops and customizes Microsoft Dynamics CRM solutions.,".NET, C++, CRM, Development, Git, Java, Microsoft Dynamics, OOP, Python, REST APIs","IBM Certified System Administrator - z/OS, IBM Mainframe Application Developer Certification"
MOBILE SECURITY SPECIALIST,"Ensures the security of mobile devices and applications, conducting assessments and implementing security measures.","Ethical Hacking, Firewalls, Linux, Mobile Security, Network Security, Penetration Testing, Risk Management, Security Protocols",Microsoft Certified: Dynamics 365 Developer Associate
NATURAL LANGUAGE PROCESSING ENGINEER,"Develops NLP models for various applications, such as chatbots and text analysis tools.","Machine Learning, NLP Algorithms, Python, Text Analysis","Certified Mobile Device Security Professional (CMDSP), GIAC Mobile Device Security Analyst (GMOB)"
NETWORK ARCHITECT,Designs and plans computer networks.,"CCNA, Firewalls, Linux, Network Design, Network Protocols, Networking, Routers, Security, Switches, System Architecture","TensorFlow Developer Certificate, DeepLearning.AI NLP Specialization"
PENETRATION TESTER,Conducts penetration tests to identify security vulnerabilities in systems and applications.,"Ethical Hacking, Penetration Testing, Security Audits, Vulnerability Assessment","Cisco Certified Internetwork Expert (CCIE), AWS Certified Advanced Networking - Specialty"
PYTHON ARCHITECT,"Designs and leads the development of Python-based systems, ensuring scalability and maintainability.","Cloud Computing, Design Patterns, Django, Flask, NumPy, Pandas, Python, System Architecture","Offensive Security Certified Professional (OSCP), GIAC Penetration Tester (GPEN)"
QUALITY ASSURANCE MANAGER,"Manages quality assurance processes, ensuring software quality through testing and automation.","Agile, Budgeting, Communication, Leadership, Project Planning, QA Processes, Scrum, Team Leadership, Test Automation, Test Planning","ISTQB Advanced Level Test Manager, Certified Quality Engineer (CQE)"
RELEASE MANAGER,"Manages software releases, coordinating activities and ensuring smooth deployments.","Agile, Budgeting, CI/CD Pipelines, Communication, Coordination, Leadership, Project Planning, Release Management, Scrum","ITIL 4 Foundation, Certified Agile Project Manager"
SAP CONSULTANT,"Consults on SAP system implementation, customization, and support.","Business Process Analysis, Customization, Implementation, SAP Modules","SAP Certified Application Associate, SAP Certified Development Specialist"
UX/UI DESIGNER,"Designs user interfaces and experiences, ensuring usability and aesthetic appeal.","Adobe XD, CSS, Canva, Design Thinking, Figma, HTML, Illustrator, JavaScript, Photoshop, Prototyping, UX/UI Design, Usability Testing, User Research, Wireframing"," Nielsen Norman Group UX Certification, Google UX Design Professional Certificate"
WEB DEVELOPER,"Develops web applications, implementing front-end and back-end components.","C++, CSS, Frameworks, Git, HTML, Java, JavaScript, OOP, Python, REST APIs, Web Development","Microsoft Certified: Azure Developer Associate, Google Mobile Web Specialist"
BACK END DEVELOPER,Develops the server-side logic and APIs for web applications.,"API Development, C++, Databases, Frameworks, Git, Java, OOP, Python, REST APIs, Server-Side Programming","AWS Certified Developer - Associate, Oracle Certified Java Developer"
WEB DESIGNER,"Creates visual designs and layouts for websites, ensuring aesthetic appeal and usability.","Canva, Figma, Graphic Design, Illustrator, Photoshop, UI/UX Principles, Web Design, Wireframing"," Adobe Certified Expert (ACE), Google Mobile Web Specialist"
WEB ENGINEER,"Designs and implements web infrastructure, ensuring scalability and reliability.","Performance Optimization, Security, System Architecture, Web Technologies"," Microsoft Certified: Azure Solutions Architect, Google Professional Cloud Developer"
WEB PRODUCER,"Manages the creation and delivery of web content, coordinating with stakeholders.","Collaboration, Content Strategy, Project Management, Web Content Management","Certified Scrum Product Owner (CSPO), Agile Certified Practitioner (PMI-ACP)"
WEB PROJECT MANAGER,"Manages web development projects, ensuring they are completed on time and within budget.","Agile, Budgeting, Communication, Leadership, Project Management, Project Planning, Scrum, Web Development","PMP (Project Management Professional), Certified ScrumMaster (CSM)"
WEB CONTENT MANAGER,"Manages web content, ensuring it is accurate, engaging, and optimized for search engines.","Agile, Budgeting, CMS, Communication, Content Creation, Content Strategy, Leadership, Project Planning, SEO, Scrum","HubSpot Content Marketing Certification, Google Analytics Individual Qualification (GAIQ)"
MULTIMEDIA ARCHITECT,Designs and produces multimedia content for various platforms.,"Audio Production, Graphic Design, Multimedia Design, Video Production","Adobe Certified Expert (ACE), Unity Certified 3D Artist"
WEB ANALYTICS DEVELOPER,Implements web analytics tools and analyzes data to improve website performance.,"A/B Testing, C++, Data Analysis, Git, Java, OOP, Python, REST APIs, Reporting, Web Analytics Tools","Google Analytics Individual Qualification (GAIQ), Adobe Analytics Business Practitioner"
SEO CONSULTANT,"Advises on SEO strategies, improving website visibility and organic traffic.","Content Optimization, Keyword Research, Link Building, Search Engine Optimization","Google SEO Fundamentals, HubSpot Content Marketing Certification"
SEO MANAGER,"Manages SEO initiatives, leading teams and monitoring performance.","Agile, Budgeting, Communication, Leadership, Performance Monitoring, Project Planning, Reporting, SEO Strategy, Scrum, Team Leadership","Google Analytics Individual Qualification (GAIQ), SEMrush SEO Toolkit Course"
INTERNET ENGINEER,"Designs, implements, and manages internet infrastructure.","Internet Technologies, Networking Protocols, Security, System Administration","Cisco Certified Internetwork Expert (CCIE), AWS Certified Advanced Networking - Specialty"
FRONT-END DESIGNER,Designs the visual elements and user interface of web applications.,"CSS, Canva, Figma, HTML, Illustrator, JavaScript, Photoshop, Responsive Design, UI/UX Design","Google Mobile Web Specialist, Microsoft Certified: Power Platform Developer Associate"
MOBILE DEVELOPER,Develops mobile applications for iOS and Android platforms.,"C++, Git, Java, Mobile App Development, OOP, Programming Languages, Python, REST APIs, UI/UX Design, iOS/Android SDKs","Google Associate Android Developer, Apple Certified iOS Developer"
PYTHON DEVELOPER,"Develops applications using Python, focusing on back-end development and automation.","C++, Data Analysis, Django, Flask, Flask), Git, Java, NumPy, OOP, Pandas, Python, REST APIs, Scripting, Web Frameworks (Django","PCEP (Certified Entry-Level Python Programmer), PCAP (Certified Associate in Python Programming)"
POWER BI DEVELOPER,Develops interactive dashboards and reports using Power BI.,"C++, DAX, Data Modeling, Data Visualization, Git, Java, OOP, Power BI, Python, REST APIs",Microsoft Certified: Power BI Data Analyst Associate
POWER BI ANALYST,Analyzes data using Power BI to provide insights and support business decision-making.,"Business Intelligence, Data Analysis, Power BI, SQL",Microsoft Certified: Data Analyst Associate
CLOUD COMPUTING SPECIALIST,"Manages and maintains cloud infrastructure, ensuring availability and performance.","AWS, Azure, Cloud Platforms, Docker, GCP, Kubernetes, Linux, Networking, Security, System Administration, Terraform, Virtualization","AWS Certified Solutions Architect, Google Professional Cloud Architect"
CYBERSECURITY SPECIALIST,Protects computer systems and networks from cyber threats.,"Compliance, Cybersecurity, Ethical Hacking, Firewalls, IDS/IPS, Incident Response, Linux, Network Security, Penetration Testing, Risk Analysis, SIEM, Security Protocols, Threat Analysis, Vulnerability Scanning","CompTIA Security+, Certified Information Systems Security Professional (CISSP)"
DATA SCIENCE SPECIALIST,Applies data science techniques to analyze data and solve business problems.,"Data Analysis, Data Visualization, Excel, Machine Learning, Matplotlib, NumPy, Pandas, Power BI, Python, SQL, Seaborn, Statistical Modeling, Tableau","Microsoft Certified: Azure Data Scientist Associate, Google Data Analytics Professional Certificate"
ARTIFICIAL INTELLIGENCE ENGINEER,"Develops AI models and applications, implementing machine learning algorithms.","AI/ML Algorithms, Deep Learning, Neural Networks, Python","TensorFlow Developer Certificate, AWS Certified Machine Learning - Specialty"
DATABASE ARCHITECT,"Designs and manages database systems, ensuring data integrity and performance.","Data Modeling, Database Design, Excel, Matplotlib, NumPy, Pandas, Performance Tuning, Power BI, Python, SQL, Seaborn, Tableau","Oracle Database SQL Certified Associate, Microsoft Certified: Azure Database Administrator Associate"
SOFTWARE ARCHITECT,"Designs and leads the development of software systems, ensuring scalability and maintainability.","Cloud Computing, Design Patterns, Programming Languages, System Architecture","AWS Certified Solutions Architect - Professional, TOGAF Certified Enterprise Architect"
CYBERSECURITY ENGINEER,Implements and manages security measures to protect computer systems and networks.,"Cybersecurity, Ethical Hacking, Firewalls, IDS/IPS, Incident Response, Linux, Network Security, Penetration Testing, Risk Analysis, Risk Management, SIEM, Security Protocols, Threat Analysis, Vulnerability Scanning","Certified Ethical Hacker (CEH), GIAC Security Essentials Certification (GSEC)"
INFOSEC ANALYST/CYBERSECURITY ANALYST,Protects computer systems and networks from cyber threats.,"Compliance, Cybersecurity, Ethical Hacking, Firewalls, IDS/IPS, Incident Response, Linux, Network Security, Penetration Testing, Risk Analysis, SIEM, Security Protocols, Threat Analysis, Vulnerability Scanning","Certified Information Systems Security Professional (CISSP), CompTIA Security+"
COMPUTER FORENSIC ANALYST,"Investigates cybercrimes and security incidents, collecting and analyzing digital evidence.","Data Recovery, Digital Forensics, Incident Response, Legal Compliance"," GIAC Certified Forensic Analyst (GCFA), Certified Computer Examiner (CCE)"
IT SECURITY SPECIALIST,Implements and manages security measures to protect computer systems and networks.,"Compliance, Ethical Hacking, Firewalls, Linux, Network Security, Penetration Testing, Risk Management, Security Protocols, Threat Analysis","Certified Information Security Manager (CISM), GIAC Security Leadership Certification (GSLC)"
SECURITY MANAGER,"Manages security teams and initiatives, ensuring the protection of IT assets.","Agile, Budgeting, Communication, Compliance, Ethical Hacking, Firewalls, Leadership, Linux, Network Security, Penetration Testing, Project Planning, Risk Assessment, Scrum, Security Management, Team Leadership","Certified Information Security Manager (CISM), Certified Information Systems Auditor (CISA)"
SECURITY ENGINEER,Implements and manages security measures to protect computer systems and networks.,"Ethical Hacking, Firewalls, Incident Response, Linux, Network Security, Penetration Testing, Risk Management, Security Protocols, Threat Analysis","Offensive Security Certified Professional (OSCP), Certified Ethical Hacker (CEH)"
